{
  "schema_version": "1.0.0",
  "project": "e2e-platform-self-test",
  "repository": "ericson-j-santos/e2e-platform",
  "sha": "aaaaaaaaaaaaaaaaaaaaaaaaaaaaaaaaaaaaaaaa",
  "environment": "ci",
  "correlation_id": "self-test-valid-001",
  "objective": "Comprovar o contrato mínimo de evidência.",
  "status": "passed",
  "started_at": "2026-09-23T15:00:00Z",
  "completed_at": "2026-09-23T15:00:01Z",
  "positive_control": {
    "passed": true,
    "evidence": "efeito esperado observado"
  },
  "negative_control": {
    "applicable": true,
    "passed": true,
    "evidence": "entrada inválida rejeitada"
  },
  "independent_read": {
    "passed": true,
    "source": "independent-state-reader",
    "evidence": "estado final confirmado"
  },
  "idempotency": {
    "applicable": true,
    "passed": true,
    "evidence": "replay sem duplicidade"
  },
  "test_of_test": {
    "applicable": true,
    "passed": true,
    "evidence": "falha conhecida foi detectada"
  }
}
